<?xml version="1.0" encoding="UTF-8"?>
<tns:PNRCheckinReq xmlns:tns="http://www.example.org/PNRCheckinRequest" xmlns:xsi="http://www.w3.org/2001/XMLSchema-instance" xsi:schemaLocation="http://www.example.org/PNRCheckinRequest PNRCheckinRequest.xsd ">
  <tns:PNR>
    <tns:PNRRecordLocator>ASHFYU</tns:PNRRecordLocator>
    <tns:ItineraryLegs>
      <tns:FlightNumber>100</tns:FlightNumber>
      <tns:OperatingCarrierCode>B6</tns:OperatingCarrierCode>
      <tns:DeptAirportCode>JFK</tns:DeptAirportCode>
      <tns:ArrAirportCode>PIT</tns:ArrAirportCode>
      <tns:SchDepDate>08-23-2018</tns:SchDepDate>
    </tns:ItineraryLegs>
    <tns:Passengers>
      <tns:FirstName>TEST</tns:FirstName>
      <tns:LastName>TEST</tns:LastName>
    </tns:Passengers>
  </tns:PNR>
</tns:PNRCheckinReq>
